{
  "schema": "avionix-next.evidence-bundle.v1",
  "evidence_id": "G2-ARM64-EMS-20260918",
  "requirement_ids": ["PRJ-003", "AVX-G2-01"],
  "gate": "G2",
  "level": "VERIFY_HW",
  "status": "PASS",
  "created_utc": "2026-09-18T11:43:12Z",
  "producer": {
    "tool": "run-g2-arm64-node.sh",
    "version": "1.0.0",
    "commit": "c331a9d3846d1f59addcea76f9db530174c8ec11"
  },
  "environment": {
    "class": "RPI4",
    "os": "Debian GNU/Linux 13",
    "architecture": "aarch64",
    "node": "efis (192.168.1.36)"
  },
  "artifacts": [
    {
      "path": "docs/status/evidence/g2-arm64-ems-20260918/report.txt",
      "sha256": "e66951087e5687339353faff04fb51cdfd99bf5728b27f8267bc119049644bea",
      "size": 2142
    }
  ],
  "checks": [
    {
      "id": "TARGET_IDENTITY",
      "status": "PASS",
      "evidence": "hostname efis, address 192.168.1.36, architecture aarch64"
    },
    {
      "id": "ICD_VALIDATOR_ARM64",
      "status": "PASS",
      "evidence": "AVIONIX ICD V1: PASS"
    },
    {
      "id": "UNIT_TESTS_ARM64",
      "status": "PASS",
      "evidence": "11/11 tests passed with Python 3.13.5"
    },
    {
      "id": "FROZEN_ARTIFACT_DIGESTS",
      "status": "PASS",
      "evidence": "ICD, schema, vectors and validator digests match the frozen G2 values"
    },
    {
      "id": "REPORT_BYTE_VERIFICATION",
      "status": "PASS",
      "evidence": "The target-side report was copied back: 2142 bytes and SHA-256 e66951087e5687339353faff04fb51cdfd99bf5728b27f8267bc119049644bea exactly match the target output"
    }
  ],
  "limitations": [
    "Only the EMS Raspberry Pi 4 node was exercised by this individual bundle; PFD and MFD are recorded separately.",
    "No live Ethernet, DDP/EDP, Pixhawk, sensor, display, touch, timing, fault-injection or flight behavior was exercised.",
    "This evidence is not flight approval."
  ],
  "flight_approval": false
}
